[
  {
    "id": "asset-bb9a76c568",
    "asset_id": "asset-bb9a76c568",
    "title": "ai-da-guan-jia",
    "asset_type": "skill_manifest",
    "domain": "AI大管家治理簇",
    "source_path": "/var/folders/mk/wfjc6qf533v3nvmjjrmdh8p80000gp/T/tmpmf_ugpwl/skills/ai-da-guan-jia/SKILL.md",
    "source_kind": "skill",
    "source_ref": "/var/folders/mk/wfjc6qf533v3nvmjjrmdh8p80000gp/T/tmpmf_ugpwl/skills/ai-da-guan-jia/SKILL.md",
    "status": "active",
    "owner_mode": "ai",
    "confidence": 0.95,
    "last_seen_at": "2026-03-11T19:39:02+08:00",
    "updated_at": "2026-03-11T19:39:02+08:00"
  },
  {
    "id": "asset-2c60786a4a",
    "asset_id": "asset-2c60786a4a",
    "title": "knowledge-orchestrator",
    "asset_type": "skill_manifest",
    "domain": "垂直workflow簇",
    "source_path": "/var/folders/mk/wfjc6qf533v3nvmjjrmdh8p80000gp/T/tmpmf_ugpwl/skills/knowledge-orchestrator/SKILL.md",
    "source_kind": "skill",
    "source_ref": "/var/folders/mk/wfjc6qf533v3nvmjjrmdh8p80000gp/T/tmpmf_ugpwl/skills/knowledge-orchestrator/SKILL.md",
    "status": "active",
    "owner_mode": "ai",
    "confidence": 0.95,
    "last_seen_at": "2026-03-11T19:39:02+08:00",
    "updated_at": "2026-03-11T19:39:02+08:00"
  },
  {
    "id": "asset-3dfbb7c7bc",
    "asset_id": "asset-3dfbb7c7bc",
    "title": "yuanli-core",
    "asset_type": "skill_manifest",
    "domain": "垂直workflow簇",
    "source_path": "/var/folders/mk/wfjc6qf533v3nvmjjrmdh8p80000gp/T/tmpmf_ugpwl/skills/yuanli-core/SKILL.md",
    "source_kind": "skill",
    "source_ref": "/var/folders/mk/wfjc6qf533v3nvmjjrmdh8p80000gp/T/tmpmf_ugpwl/skills/yuanli-core/SKILL.md",
    "status": "active",
    "owner_mode": "ai",
    "confidence": 0.95,
    "last_seen_at": "2026-03-11T19:39:02+08:00",
    "updated_at": "2026-03-11T19:39:02+08:00"
  },
  {
    "id": "asset-db38f755e1",
    "asset_id": "asset-db38f755e1",
    "title": "Daily skill review",
    "asset_type": "automation_manifest",
    "domain": "automation",
    "source_path": "/var/folders/mk/wfjc6qf533v3nvmjjrmdh8p80000gp/T/tmpmf_ugpwl/automations/daily-skill-co-review/automation.toml",
    "source_kind": "automation",
    "source_ref": "/var/folders/mk/wfjc6qf533v3nvmjjrmdh8p80000gp/T/tmpmf_ugpwl/automations/daily-skill-co-review/automation.toml",
    "status": "active",
    "owner_mode": "ai",
    "confidence": 0.95,
    "last_seen_at": "2026-03-11T19:39:02+08:00",
    "updated_at": "2026-03-11T19:39:02+08:00"
  },
  {
    "id": "asset-2e787b29ef",
    "asset_id": "asset-2e787b29ef",
    "title": "Other automation",
    "asset_type": "automation_manifest",
    "domain": "automation",
    "source_path": "/var/folders/mk/wfjc6qf533v3nvmjjrmdh8p80000gp/T/tmpmf_ugpwl/automations/other-automation/automation.toml",
    "source_kind": "automation",
    "source_ref": "/var/folders/mk/wfjc6qf533v3nvmjjrmdh8p80000gp/T/tmpmf_ugpwl/automations/other-automation/automation.toml",
    "status": "active",
    "owner_mode": "ai",
    "confidence": 0.95,
    "last_seen_at": "2026-03-11T19:39:02+08:00",
    "updated_at": "2026-03-11T19:39:02+08:00"
  },
  {
    "id": "asset-e928ad845d",
    "asset_id": "asset-e928ad845d",
    "title": "strategic-goals.json",
    "asset_type": "strategy_artifact",
    "domain": "governance",
    "source_path": "/var/folders/mk/wfjc6qf533v3nvmjjrmdh8p80000gp/T/tmpmf_ugpwl/strategy/current/strategic-goals.json",
    "source_kind": "file",
    "source_ref": "/var/folders/mk/wfjc6qf533v3nvmjjrmdh8p80000gp/T/tmpmf_ugpwl/strategy/current/strategic-goals.json",
    "status": "active",
    "owner_mode": "ai",
    "confidence": 0.98,
    "last_seen_at": "2026-03-11T19:39:02+08:00",
    "updated_at": "2026-03-11T19:39:02+08:00"
  },
  {
    "id": "asset-dea31761c8",
    "asset_id": "asset-dea31761c8",
    "title": "active-threads.json",
    "asset_type": "strategy_artifact",
    "domain": "governance",
    "source_path": "/var/folders/mk/wfjc6qf533v3nvmjjrmdh8p80000gp/T/tmpmf_ugpwl/strategy/current/active-threads.json",
    "source_kind": "file",
    "source_ref": "/var/folders/mk/wfjc6qf533v3nvmjjrmdh8p80000gp/T/tmpmf_ugpwl/strategy/current/active-threads.json",
    "status": "active",
    "owner_mode": "ai",
    "confidence": 0.98,
    "last_seen_at": "2026-03-11T19:39:02+08:00",
    "updated_at": "2026-03-11T19:39:02+08:00"
  },
  {
    "id": "asset-95cc575503",
    "asset_id": "asset-95cc575503",
    "title": "governance-dashboard.md",
    "asset_type": "strategy_artifact",
    "domain": "governance",
    "source_path": "/var/folders/mk/wfjc6qf533v3nvmjjrmdh8p80000gp/T/tmpmf_ugpwl/strategy/current/governance-dashboard.md",
    "source_kind": "file",
    "source_ref": "/var/folders/mk/wfjc6qf533v3nvmjjrmdh8p80000gp/T/tmpmf_ugpwl/strategy/current/governance-dashboard.md",
    "status": "active",
    "owner_mode": "ai",
    "confidence": 0.98,
    "last_seen_at": "2026-03-11T19:39:02+08:00",
    "updated_at": "2026-03-11T19:39:02+08:00"
  },
  {
    "id": "asset-f46f3b9b0a",
    "asset_id": "asset-f46f3b9b0a",
    "title": "routing-credit.json",
    "asset_type": "strategy_artifact",
    "domain": "governance",
    "source_path": "/var/folders/mk/wfjc6qf533v3nvmjjrmdh8p80000gp/T/tmpmf_ugpwl/strategy/current/routing-credit.json",
    "source_kind": "file",
    "source_ref": "/var/folders/mk/wfjc6qf533v3nvmjjrmdh8p80000gp/T/tmpmf_ugpwl/strategy/current/routing-credit.json",
    "status": "active",
    "owner_mode": "ai",
    "confidence": 0.98,
    "last_seen_at": "2026-03-11T19:39:02+08:00",
    "updated_at": "2026-03-11T19:39:02+08:00"
  },
  {
    "id": "asset-32ee183515",
    "asset_id": "asset-32ee183515",
    "title": "org-taxonomy.md",
    "asset_type": "strategy_artifact",
    "domain": "governance",
    "source_path": "/var/folders/mk/wfjc6qf533v3nvmjjrmdh8p80000gp/T/tmpmf_ugpwl/strategy/current/org-taxonomy.md",
    "source_kind": "file",
    "source_ref": "/var/folders/mk/wfjc6qf533v3nvmjjrmdh8p80000gp/T/tmpmf_ugpwl/strategy/current/org-taxonomy.md",
    "status": "active",
    "owner_mode": "ai",
    "confidence": 0.98,
    "last_seen_at": "2026-03-11T19:39:02+08:00",
    "updated_at": "2026-03-11T19:39:02+08:00"
  },
  {
    "id": "asset-0e8210eb75",
    "asset_id": "asset-0e8210eb75",
    "title": "review-state.json",
    "asset_type": "strategy_artifact",
    "domain": "governance",
    "source_path": "/var/folders/mk/wfjc6qf533v3nvmjjrmdh8p80000gp/T/tmpmf_ugpwl/review-state.json",
    "source_kind": "file",
    "source_ref": "/var/folders/mk/wfjc6qf533v3nvmjjrmdh8p80000gp/T/tmpmf_ugpwl/review-state.json",
    "status": "active",
    "owner_mode": "ai",
    "confidence": 0.98,
    "last_seen_at": "2026-03-11T19:39:02+08:00",
    "updated_at": "2026-03-11T19:39:02+08:00"
  },
  {
    "id": "asset-4b4ef39829",
    "asset_id": "asset-4b4ef39829",
    "title": "review.json",
    "asset_type": "strategy_artifact",
    "domain": "governance",
    "source_path": "/var/folders/mk/wfjc6qf533v3nvmjjrmdh8p80000gp/T/tmpmf_ugpwl/reviews/2026-03-11/run-01/review.json",
    "source_kind": "file",
    "source_ref": "/var/folders/mk/wfjc6qf533v3nvmjjrmdh8p80000gp/T/tmpmf_ugpwl/reviews/2026-03-11/run-01/review.json",
    "status": "active",
    "owner_mode": "ai",
    "confidence": 0.98,
    "last_seen_at": "2026-03-11T19:39:02+08:00",
    "updated_at": "2026-03-11T19:39:02+08:00"
  },
  {
    "id": "asset-002fec35ee",
    "asset_id": "asset-002fec35ee",
    "title": "ontology.db",
    "asset_type": "ontology_db",
    "domain": "ontology",
    "source_path": "/var/folders/mk/wfjc6qf533v3nvmjjrmdh8p80000gp/T/tmpmf_ugpwl/ontology.db",
    "source_kind": "file",
    "source_ref": "/var/folders/mk/wfjc6qf533v3nvmjjrmdh8p80000gp/T/tmpmf_ugpwl/ontology.db",
    "status": "active",
    "owner_mode": "ai",
    "confidence": 0.98,
    "last_seen_at": "2026-03-11T19:39:02+08:00",
    "updated_at": "2026-03-11T19:39:02+08:00"
  },
  {
    "id": "asset-f3de576787",
    "asset_id": "asset-f3de576787",
    "title": "operational-ontology-v0.md",
    "asset_type": "strategy_artifact",
    "domain": "governance",
    "source_path": "/Users/hay2045/Documents/codex-ai-gua-jia-01/specs/operational-ontology-v0.md",
    "source_kind": "file",
    "source_ref": "/Users/hay2045/Documents/codex-ai-gua-jia-01/specs/operational-ontology-v0.md",
    "status": "active",
    "owner_mode": "ai",
    "confidence": 0.98,
    "last_seen_at": "2026-03-11T19:39:02+08:00",
    "updated_at": "2026-03-11T19:39:02+08:00"
  },
  {
    "id": "asset-9ef9f59efd",
    "asset_id": "asset-9ef9f59efd",
    "title": "action-catalog-v0.json",
    "asset_type": "strategy_artifact",
    "domain": "governance",
    "source_path": "/Users/hay2045/Documents/codex-ai-gua-jia-01/specs/action-catalog-v0.json",
    "source_kind": "file",
    "source_ref": "/Users/hay2045/Documents/codex-ai-gua-jia-01/specs/action-catalog-v0.json",
    "status": "active",
    "owner_mode": "ai",
    "confidence": 0.98,
    "last_seen_at": "2026-03-11T19:39:02+08:00",
    "updated_at": "2026-03-11T19:39:02+08:00"
  },
  {
    "id": "asset-9d10e106f2",
    "asset_id": "asset-9d10e106f2",
    "title": "policy-boundary-v0.md",
    "asset_type": "strategy_artifact",
    "domain": "governance",
    "source_path": "/Users/hay2045/Documents/codex-ai-gua-jia-01/specs/policy-boundary-v0.md",
    "source_kind": "file",
    "source_ref": "/Users/hay2045/Documents/codex-ai-gua-jia-01/specs/policy-boundary-v0.md",
    "status": "active",
    "owner_mode": "ai",
    "confidence": 0.98,
    "last_seen_at": "2026-03-11T19:39:02+08:00",
    "updated_at": "2026-03-11T19:39:02+08:00"
  },
  {
    "id": "asset-43fab3062c",
    "asset_id": "asset-43fab3062c",
    "title": "operational-ontology-implementation-plan-v0.md",
    "asset_type": "strategy_artifact",
    "domain": "governance",
    "source_path": "/Users/hay2045/Documents/codex-ai-gua-jia-01/specs/operational-ontology-implementation-plan-v0.md",
    "source_kind": "file",